{
  "$schema": "http://json-schema.org/draft-07/schema#",
  "$id": "https://machine_max.io/schemas/subsystem/static/sight_static_attr.json",
  "title": "Sight Subsystem Static Attributes",
  "description": "固定炮镜的光学与武器瞄准稳定配置；设备自身没有独立观察转轴。",
  "properties": {
    "type": {
      "type": "string",
      "const": "machine_max:sight",
      "description": "Subsystem type, must be 'machine_max:sight'."
    },
    "basic_durability": {
      "type": "number",
      "default": 20.0,
      "description": "Basic durability, subsystem is disabled when it drops to 0 and restored when repaired to 30%."
    },
    "pass_damage": {
      "type": "boolean",
      "default": true,
      "description": "Whether to pass damage to the subsystem holder."
    },
    "limit_damage": {
      "type": "boolean",
      "default": false,
      "description": "Whether to limit the damage transfer value to the remaining durability."
    },
    "hidden": {
      "type": "boolean",
      "default": false,
      "description": "Whether to hide the subsystem in the HUD display."
    },
    "vertical_stabilized": {
      "type": "boolean",
      "default": false,
      "description": "武器期望目标的对应轴按世界点保持。"
    },
    "horizontal_stabilized": {
      "type": "boolean",
      "default": false,
      "description": "武器期望目标的对应轴按世界点保持。"
    },
    "base_zoom": {
      "type": "number",
      "default": 1.0,
      "description": "Minimum zoom multiplier (default 1.0, i.e., base FOV)."
    },
    "max_zoom": {
      "type": "number",
      "default": 1.0,
      "description": "Maximum zoom multiplier (e.g., 8.0 for 8x)."
    },
    "scope_hud_layout": {
      "allOf": [
        {
          "$ref": "../../base/resource_location.schema.json"
        }
      ],
      "default": "machine_max:empty",
      "description": "炮镜视角使用的 HUD 布局资源地址：内容包 hud_layouts/ 下的文件，键为 <命名空间>:<相对路径>；缺失表示炮镜不显示该布局提供的 HUD。"
    },
    "discovery_inputs": {
      "type": "array",
      "items": {
        "type": "string"
      },
      "default": [
        "camera_sight"
      ],
      "description": "List of sight discovery handshake channels (ordered by priority)."
    },
    "allow_cycle": {
      "type": "boolean",
      "default": true,
      "description": "Whether to allow this sight to appear in the F5 camera cycle."
    },
    "sounds": {
      "type": "object",
      "properties": {
        "on_destroyed": {
          "allOf": [
            {
              "$ref": "../../base/sound_event.schema.json"
            }
          ],
          "description": "Sound event when the sight is destroyed.",
          "default": {
            "sound_id": "machine_max:empty_sound",
            "range": 16
          }
        },
        "on_activate": {
          "allOf": [
            {
              "$ref": "../../base/sound_event.schema.json"
            }
          ],
          "description": "Sound event when the sight is activated.",
          "default": {
            "sound_id": "machine_max:empty_sound",
            "range": 16
          }
        },
        "on_deactivate": {
          "allOf": [
            {
              "$ref": "../../base/sound_event.schema.json"
            }
          ],
          "description": "Sound event when the sight is deactivated.",
          "default": {
            "sound_id": "machine_max:empty_sound",
            "range": 16
          }
        }
      },
      "additionalProperties": false,
      "description": "Basic sound configuration for the sight."
    }
  },
  "required": [
    "type"
  ],
  "examples": [
    {
      "type": "machine_max:sight",
      "basic_durability": 15.0,
      "base_zoom": 1.0,
      "max_zoom": 5.0,
      "discovery_inputs": [
        "gunner_optics"
      ],
      "scope_hud_layout": "machine_max:scope_gunner"
    }
  ]
}
