{
  "$schema": "../../docs/zh_cn/schemas/subsystem/subsystem_static_attr.schema.json",
  "type": "machine_max:sight",
  "basic_durability": 10,
  "vertical_stabilized": true,
  "horizontal_stabilized": true,
  "base_zoom": 1.0,
  "max_zoom": 8.0,
  "scope_hud_layout": "machine_max:scope_gunner_fixed",
  "discovery_inputs": [
    "gunner_sight"
  ],
  "allow_cycle": true
}
